<!ELEMENT carDealership (id,name, establishedYear, totalIncome, cars)>
        <!ELEMENT id (#PCDATA)>
        <!ELEMENT name (#PCDATA)>
        <!ELEMENT establishedYear (#PCDATA)>
        <!ELEMENT totalIncome (#PCDATA)>
        <!ELEMENT cars (car+)>
        <!ELEMENT car (id, model, year, price, electric)>
        <!ELEMENT model (#PCDATA)>
        <!ELEMENT year (#PCDATA)>
        <!ELEMENT price (#PCDATA)>
        <!ELEMENT electric (#PCDATA)>